<?xml version="1.0" encoding="utf-8"?>
<!--
SPDX-FileCopyrightText: Copyright (c) 2022 GARDENA GmbH
SPDX-License-Identifier: GPL-3.0-or-later
-->
<LWM2M xmlns:xsi="http://www.w3.org/2001/XMLSchema-instance" xsi:noNamespaceSchemaLocation="http://www.openmobilealliance.org/tech/profiles/LWM2M-v1_1.xsd">
    <Object ObjectType="MODefinition">
		<Name>SmartSystemMowerApi__StartingPoints</Name>
		<Description1><![CDATA[]]></Description1>
		<ObjectID>31507</ObjectID>
		<ObjectURN>urn:oma:lwm2m:x:31507:0.1</ObjectURN>
		<LWM2MVersion>1.1</LWM2MVersion>
		<ObjectVersion>0.1</ObjectVersion>
		<MultipleInstances>Multiple</MultipleInstances>
		<Mandatory>Optional</Mandatory>
		<Resources>
			<Item ID="1">
				<Name>enabled</Name>
				<Operations>RW</Operations>
				<MultipleInstances>Single</MultipleInstances>
				<Mandatory>Mandatory</Mandatory>
				<Type>Boolean</Type>
				<RangeEnumeration></RangeEnumeration>
				<Units></Units>
				<Description><![CDATA[]]></Description>
			</Item>
			<Item ID="2">
				<Name>proportion</Name>
				<Operations>RW</Operations>
				<MultipleInstances>Single</MultipleInstances>
				<Mandatory>Mandatory</Mandatory>
				<Type>Unsigned Integer</Type>
				<RangeEnumeration></RangeEnumeration>
				<Units>%</Units>
				<Description><![CDATA[]]></Description>
			</Item>
			<Item ID="3">
				<Name>wire</Name>
				<Operations>RW</Operations>
				<MultipleInstances>Single</MultipleInstances>
				<Mandatory>Mandatory</Mandatory>
				<Type>Unsigned Integer</Type>
				<RangeEnumeration></RangeEnumeration>
				<Units></Units>
				<Description><![CDATA[]]></Description>
			</Item>
			<Item ID="4">
				<Name>distance</Name>
				<Operations>RW</Operations>
				<MultipleInstances>Single</MultipleInstances>
				<Mandatory>Mandatory</Mandatory>
				<Type>Unsigned Integer</Type>
				<RangeEnumeration></RangeEnumeration>
				<Units>m</Units>
				<Description><![CDATA[]]></Description>
			</Item>
			<Item ID="5">
				<Name>passageCuttingEnabled</Name>
				<Operations>RW</Operations>
				<MultipleInstances>Single</MultipleInstances>
				<Mandatory>Mandatory</Mandatory>
				<Type>Boolean</Type>
				<RangeEnumeration></RangeEnumeration>
				<Units></Units>
				<Description><![CDATA[]]></Description>
			</Item>
		</Resources>
		<Description2><![CDATA[]]></Description2>
	</Object>
</LWM2M>
