<?xml version="1.0" encoding="utf-8"?>
<!--
SPDX-FileCopyrightText: Copyright (c) 2022 GARDENA GmbH
SPDX-License-Identifier: LicenseRef-GARDENA
-->
<LWM2M xmlns:xsi="http://www.w3.org/2001/XMLSchema-instance" xsi:noNamespaceSchemaLocation="http://www.openmobilealliance.org/tech/profiles/LWM2M-v1_1.xsd">
    <Object ObjectType="MODefinition">
		<Name>Battery</Name>
		<Description1><![CDATA[]]></Description1>
		<ObjectID>31418</ObjectID>
		<ObjectURN>urn:oma:lwm2m:x:31418:0.1</ObjectURN>
		<LWM2MVersion>1.1</LWM2MVersion>
		<ObjectVersion>0.1</ObjectVersion>
		<MultipleInstances>Single</MultipleInstances>
		<Mandatory>Optional</Mandatory>
		<Resources>
			<Item ID="1">
				<Name>ChargeLevel</Name>
				<Operations>R</Operations>
				<MultipleInstances>Single</MultipleInstances>
				<Mandatory>Mandatory</Mandatory>
				<Type>Unsigned Integer</Type>
				<RangeEnumeration></RangeEnumeration>
				<Units>%</Units>
				<Description><![CDATA[]]></Description>
			</Item>
			<Item ID="2">
				<Name>Voltage</Name>
				<Operations>R</Operations>
				<MultipleInstances>Single</MultipleInstances>
				<Mandatory>Mandatory</Mandatory>
				<Type>Unsigned Integer</Type>
				<RangeEnumeration></RangeEnumeration>
				<Units>mV</Units>
				<Description><![CDATA[]]></Description>
			</Item>
			<Item ID="3">
				<Name>IsCharging</Name>
				<Operations>R</Operations>
				<MultipleInstances>Single</MultipleInstances>
				<Mandatory>Mandatory</Mandatory>
				<Type>Boolean</Type>
				<RangeEnumeration></RangeEnumeration>
				<Units></Units>
				<Description><![CDATA[]]></Description>
			</Item>
			<Item ID="4">
				<Name>RemainingChargingTime</Name>
				<Operations>R</Operations>
				<MultipleInstances>Single</MultipleInstances>
				<Mandatory>Mandatory</Mandatory>
				<Type>Unsigned Integer</Type>
				<RangeEnumeration></RangeEnumeration>
				<Units>s</Units>
				<Description><![CDATA[]]></Description>
			</Item>
			<Item ID="5">
				<Name>Current</Name>
				<Operations>R</Operations>
				<MultipleInstances>Single</MultipleInstances>
				<Mandatory>Mandatory</Mandatory>
				<Type>Integer</Type>
				<RangeEnumeration></RangeEnumeration>
				<Units>mA</Units>
				<Description><![CDATA[]]></Description>
			</Item>
			<Item ID="6">
				<Name>Temperature</Name>
				<Operations>R</Operations>
				<MultipleInstances>Single</MultipleInstances>
				<Mandatory>Mandatory</Mandatory>
				<Type>Integer</Type>
				<RangeEnumeration></RangeEnumeration>
				<Units>°C</Units>
				<Description><![CDATA[]]></Description>
			</Item>
		</Resources>
		<Description2><![CDATA[]]></Description2>
	</Object>
</LWM2M>
