<?xml version="1.0" encoding="utf-8"?>
<!--
SPDX-FileCopyrightText: Copyright (c) 2022 GARDENA GmbH
SPDX-License-Identifier: GPL-3.0-or-later
-->
<LWM2M xmlns:xsi="http://www.w3.org/2001/XMLSchema-instance" xsi:noNamespaceSchemaLocation="http://www.openmobilealliance.org/tech/profiles/LWM2M-v1_1.xsd">
    <Object ObjectType="MODefinition">
        <Name>MowerInsights</Name>
        <Description1><![CDATA[]]></Description1>
        <ObjectID>31428</ObjectID>
        <ObjectURN>urn:oma:lwm2m:x:31428:0.1</ObjectURN>
        <LWM2MVersion>1.1</LWM2MVersion>
        <ObjectVersion>0.1</ObjectVersion>
        <MultipleInstances>Single</MultipleInstances>
        <Mandatory>Optional</Mandatory>
        <Resources>
            <Item ID="1">
                <Name>BatteryCapacity</Name>
                <Operations>R</Operations>
                <MultipleInstances>Single</MultipleInstances>
                <Mandatory>Mandatory</Mandatory>
                <Type>Unsigned Integer</Type>
                <RangeEnumeration></RangeEnumeration>
                <Units>mAh</Units>
                <Description><![CDATA[]]></Description>
            </Item>
            <Item ID="2">
                <Name>BatteryCurrent</Name>
                <Operations>R</Operations>
                <MultipleInstances>Single</MultipleInstances>
                <Mandatory>Mandatory</Mandatory>
                <Type>Integer</Type>
                <RangeEnumeration></RangeEnumeration>
                <Units>mA</Units>
                <Description><![CDATA[]]></Description>
            </Item>
            <Item ID="3">
                <Name>BatteryNrOfChargingCycles</Name>
                <Operations>R</Operations>
                <MultipleInstances>Single</MultipleInstances>
                <Mandatory>Mandatory</Mandatory>
                <Type>Unsigned Integer</Type>
                <RangeEnumeration></RangeEnumeration>
                <Units></Units>
                <Description><![CDATA[]]></Description>
            </Item>
            <Item ID="4">
                <Name>BatteryTemperature</Name>
                <Operations>R</Operations>
                <MultipleInstances>Single</MultipleInstances>
                <Mandatory>Mandatory</Mandatory>
                <Type>Integer</Type>
                <RangeEnumeration></RangeEnumeration>
                <Units>°C</Units>
                <Description><![CDATA[]]></Description>
            </Item>
            <Item ID="5">
                <Name>BatteryVoltage</Name>
                <Operations>R</Operations>
                <MultipleInstances>Single</MultipleInstances>
                <Mandatory>Mandatory</Mandatory>
                <Type>Unsigned Integer</Type>
                <RangeEnumeration></RangeEnumeration>
                <Units>mV</Units>
                <Description><![CDATA[]]></Description>
            </Item>
            <Item ID="6">
                <Name>OrientationPitch</Name>
                <Operations>R</Operations>
                <MultipleInstances>Single</MultipleInstances>
                <Mandatory>Mandatory</Mandatory>
                <Type>Integer</Type>
                <RangeEnumeration></RangeEnumeration>
                <Units>0.1°</Units>
                <Description><![CDATA[]]></Description>
            </Item>
            <Item ID="7">
                <Name>OrientationRoll</Name>
                <Operations>R</Operations>
                <MultipleInstances>Single</MultipleInstances>
                <Mandatory>Mandatory</Mandatory>
                <Type>Integer</Type>
                <RangeEnumeration></RangeEnumeration>
                <Units>0.1°</Units>
                <Description><![CDATA[]]></Description>
            </Item>
            <Item ID="8">
                <Name>StartUpdateTimer</Name>
                <Operations>E</Operations>
                <MultipleInstances>Single</MultipleInstances>
                <Mandatory>Mandatory</Mandatory>
                <Type></Type>
                <RangeEnumeration></RangeEnumeration>
                <Units></Units>
                <Description><![CDATA[]]></Description>
            </Item>
        </Resources>
        <Description2><![CDATA[]]></Description2>
    </Object>
</LWM2M>
