<?xml version="1.0" encoding="utf-8"?>
<!--
SPDX-FileCopyrightText: Copyright (c) 2022 GARDENA GmbH
SPDX-License-Identifier: GPL-3.0-or-later
-->
<LWM2M xmlns:xsi="http://www.w3.org/2001/XMLSchema-instance" xsi:noNamespaceSchemaLocation="http://www.openmobilealliance.org/tech/profiles/LWM2M-v1_1.xsd">
    <Object ObjectType="MODefinition">
		<Name>MowerApp</Name>
		<Description1><![CDATA[high level interface of the mower application]]></Description1>
		<ObjectID>31400</ObjectID>
		<ObjectURN>urn:oma:lwm2m:x:31400:0.1</ObjectURN>
		<LWM2MVersion>1.1</LWM2MVersion>
		<ObjectVersion>0.1</ObjectVersion>
		<MultipleInstances>Single</MultipleInstances>
		<Mandatory>Optional</Mandatory>
		<Resources>
			<Item ID="1">
				<Name>Mode</Name>
				<Operations>RW</Operations>
				<MultipleInstances>Single</MultipleInstances>
				<Mandatory>Mandatory</Mandatory>
				<Type>Unsigned Integer</Type>
				<RangeEnumeration></RangeEnumeration>
				<Units></Units>
				<Description><![CDATA[]]></Description>
			</Item>
			<Item ID="2">
				<Name>State</Name>
				<Operations>R</Operations>
				<MultipleInstances>Single</MultipleInstances>
				<Mandatory>Mandatory</Mandatory>
				<Type>Unsigned Integer</Type>
				<RangeEnumeration></RangeEnumeration>
				<Units></Units>
				<Description><![CDATA[]]></Description>
			</Item>
			<Item ID="3">
				<Name>Activity</Name>
				<Operations>R</Operations>
				<MultipleInstances>Single</MultipleInstances>
				<Mandatory>Mandatory</Mandatory>
				<Type>Unsigned Integer</Type>
				<RangeEnumeration></RangeEnumeration>
				<Units></Units>
				<Description><![CDATA[]]></Description>
			</Item>
			<Item ID="4">
				<Name>Error</Name>
				<Operations>R</Operations>
				<MultipleInstances>Single</MultipleInstances>
				<Mandatory>Mandatory</Mandatory>
				<Type>Unsigned Integer</Type>
				<RangeEnumeration></RangeEnumeration>
				<Units></Units>
				<Description><![CDATA[]]></Description>
			</Item>
			<Item ID="5">
				<Name>IsErrorConfirmable</Name>
				<Operations>R</Operations>
				<MultipleInstances>Single</MultipleInstances>
				<Mandatory>Mandatory</Mandatory>
				<Type>Boolean</Type>
				<RangeEnumeration></RangeEnumeration>
				<Units></Units>
				<Description><![CDATA[]]></Description>
			</Item>
			<Item ID="6">
				<Name>Mission</Name>
				<Operations>RW</Operations>
				<MultipleInstances>Single</MultipleInstances>
				<Mandatory>Mandatory</Mandatory>
				<Type>Unsigned Integer</Type>
				<RangeEnumeration></RangeEnumeration>
				<Units></Units>
				<Description><![CDATA[]]></Description>
			</Item>
			<Item ID="7">
				<Name>StartTrigger</Name>
				<Operations>E</Operations>
				<MultipleInstances>Single</MultipleInstances>
				<Mandatory>Mandatory</Mandatory>
				<Type></Type>
				<RangeEnumeration></RangeEnumeration>
				<Units></Units>
				<Description><![CDATA[]]></Description>
			</Item>
			<Item ID="8">
				<Name>Pause</Name>
				<Operations>E</Operations>
				<MultipleInstances>Single</MultipleInstances>
				<Mandatory>Mandatory</Mandatory>
				<Type></Type>
				<RangeEnumeration></RangeEnumeration>
				<Units></Units>
				<Description><![CDATA[]]></Description>
			</Item>
			<Item ID="9">
				<Name>ConfirmError</Name>
				<Operations>E</Operations>
				<MultipleInstances>Single</MultipleInstances>
				<Mandatory>Mandatory</Mandatory>
				<Type></Type>
				<RangeEnumeration></RangeEnumeration>
				<Units></Units>
				<Description><![CDATA[]]></Description>
			</Item>
		</Resources>
		<Description2><![CDATA[]]></Description2>
	</Object>
</LWM2M>
