<?xml version="1.0" encoding="utf-8"?>
<!--
SPDX-FileCopyrightText: Copyright (c) 2022 GARDENA GmbH
SPDX-License-Identifier: LicenseRef-GARDENA
-->
<LWM2M xmlns:xsi="http://www.w3.org/2001/XMLSchema-instance" xsi:noNamespaceSchemaLocation="http://www.openmobilealliance.org/tech/profiles/LWM2M-v1_1.xsd">
    <Object ObjectType="MODefinition">
		<Name>Calendar</Name>
		<Description1><![CDATA[handler of mowing tasks]]></Description1>
		<ObjectID>31402</ObjectID>
		<ObjectURN>urn:oma:lwm2m:x:31402:0.1</ObjectURN>
		<LWM2MVersion>1.1</LWM2MVersion>
		<ObjectVersion>0.1</ObjectVersion>
		<MultipleInstances>Single</MultipleInstances>
		<Mandatory>Optional</Mandatory>
		<Resources>
			<Item ID="1">
				<Name>MaxNumberOfTasks</Name>
				<Operations>R</Operations>
				<MultipleInstances>Single</MultipleInstances>
				<Mandatory>Mandatory</Mandatory>
				<Type>Unsigned Integer</Type>
				<RangeEnumeration></RangeEnumeration>
				<Units></Units>
				<Description><![CDATA[Max number of tasks]]></Description>
			</Item>
			<Item ID="2">
				<Name>MaxNumberOfTasksPerDay</Name>
				<Operations>R</Operations>
				<MultipleInstances>Single</MultipleInstances>
				<Mandatory>Mandatory</Mandatory>
				<Type>Unsigned Integer</Type>
				<RangeEnumeration></RangeEnumeration>
				<Units></Units>
				<Description><![CDATA[Max number of tasks per day]]></Description>
			</Item>
		</Resources>
		<Description2><![CDATA[The Calendar handles mowing tasks. Use this module to control at what times and what week days the mower shall be active.

## Task handling
Tasks can be added, modified and deleted. They are accessed using task indexes, which will always be in and uninterrupted range from 0 to number of tasks.

Note! An index of a task is not constant, if a task is deleted the other tasks may have updated indexes. I.e., there is no point in remembering an index of a task for later usage, since it may have been updated.

## Task transaction
If several modifications to the Calendar shall be done at one instance, a transaction shall be used. After a call to StartTransactions, all modifications are done in a sand box until CommitTransaction is performed. If a transaction is not used for 2s, it is discarded.
]]></Description2>
	</Object>
</LWM2M>
