<?xml version="1.0" encoding="utf-8"?>
<!--
SPDX-FileCopyrightText: Copyright (c) 2022 GARDENA GmbH
SPDX-License-Identifier: LicenseRef-GARDENA
-->
<LWM2M xmlns:xsi="http://www.w3.org/2001/XMLSchema-instance" xsi:noNamespaceSchemaLocation="http://www.openmobilealliance.org/tech/profiles/LWM2M-v1_1.xsd">
    <Object ObjectType="MODefinition">
		<Name>SiteMap</Name>
		<Description1><![CDATA[]]></Description1>
		<ObjectID>31417</ObjectID>
		<ObjectURN>urn:oma:lwm2m:x:31417:0.1</ObjectURN>
		<LWM2MVersion>1.1</LWM2MVersion>
		<ObjectVersion>0.1</ObjectVersion>
		<MultipleInstances>Single</MultipleInstances>
		<Mandatory>Optional</Mandatory>
		<Resources>
			<Item ID="1">
				<Name>Available</Name>
				<Operations>RW</Operations>
				<MultipleInstances>Single</MultipleInstances>
				<Mandatory>Mandatory</Mandatory>
				<Type>Boolean</Type>
				<RangeEnumeration></RangeEnumeration>
				<Units></Units>
				<Description><![CDATA[]]></Description>
			</Item>
			<Item ID="2">
				<Name>UserValidatedChecksum</Name>
				<Operations>RW</Operations>
				<MultipleInstances>Single</MultipleInstances>
				<Mandatory>Mandatory</Mandatory>
				<Type>Opaque</Type>
				<RangeEnumeration></RangeEnumeration>
				<Units></Units>
				<Description><![CDATA[]]></Description>
			</Item>
			<Item ID="3">
				<Name>ZoneMapAvailable</Name>
				<Operations>RW</Operations>
				<MultipleInstances>Single</MultipleInstances>
				<Mandatory>Mandatory</Mandatory>
				<Type>Boolean</Type>
				<RangeEnumeration></RangeEnumeration>
				<Units></Units>
				<Description><![CDATA[]]></Description>
			</Item>
			<Item ID="4">
				<Name>SiteMapAvailable</Name>
				<Operations>RW</Operations>
				<MultipleInstances>Single</MultipleInstances>
				<Mandatory>Mandatory</Mandatory>
				<Type>Boolean</Type>
				<RangeEnumeration></RangeEnumeration>
				<Units></Units>
				<Description><![CDATA[]]></Description>
			</Item>
			<Item ID="5">
				<Name>GeneratedMapAvailable</Name>
				<Operations>RW</Operations>
				<MultipleInstances>Single</MultipleInstances>
				<Mandatory>Mandatory</Mandatory>
				<Type>Boolean</Type>
				<RangeEnumeration></RangeEnumeration>
				<Units></Units>
				<Description><![CDATA[]]></Description>
			</Item>
			<Item ID="6">
				<Name>SiteMap</Name>
				<Operations>RW</Operations>
				<MultipleInstances>Single</MultipleInstances>
				<Mandatory>Mandatory</Mandatory>
				<Type>Opaque</Type>
				<RangeEnumeration></RangeEnumeration>
				<Units></Units>
				<Description><![CDATA[]]></Description>
			</Item>
			<Item ID="7">
				<Name>GeneratedMap</Name>
				<Operations>RW</Operations>
				<MultipleInstances>Single</MultipleInstances>
				<Mandatory>Mandatory</Mandatory>
				<Type>Opaque</Type>
				<RangeEnumeration></RangeEnumeration>
				<Units></Units>
				<Description><![CDATA[]]></Description>
			</Item>
			<Item ID="8">
				<Name>ZoneMap</Name>
				<Operations>RW</Operations>
				<MultipleInstances>Single</MultipleInstances>
				<Mandatory>Mandatory</Mandatory>
				<Type>Opaque</Type>
				<RangeEnumeration></RangeEnumeration>
				<Units></Units>
				<Description><![CDATA[]]></Description>
			</Item>
		</Resources>
		<Description2><![CDATA[]]></Description2>
	</Object>
</LWM2M>
