<?xml version="1.0" encoding="utf-8"?>
<!--
SPDX-FileCopyrightText: Copyright (c) 2022 GARDENA GmbH
SPDX-License-Identifier: GPL-3.0-or-later
-->
<LWM2M xmlns:xsi="http://www.w3.org/2001/XMLSchema-instance" xsi:noNamespaceSchemaLocation="http://www.openmobilealliance.org/tech/profiles/LWM2M-v1_1.xsd">
    <Object ObjectType="MODefinition">
        <Name>System</Name>
        <Description1><![CDATA[system settings of the mower]]></Description1>
        <ObjectID>31403</ObjectID>
        <ObjectURN>urn:oma:lwm2m:x:31403:0.3</ObjectURN>
        <LWM2MVersion>1.1</LWM2MVersion>
        <ObjectVersion>0.3</ObjectVersion>
        <MultipleInstances>Single</MultipleInstances>
        <Mandatory>Optional</Mandatory>
        <Resources>
            <Item ID="1">
                <Name>StartupSequenceRequired</Name>
                <Operations>RW</Operations>
                <MultipleInstances>Single</MultipleInstances>
                <Mandatory>Mandatory</Mandatory>
                <Type>Boolean</Type>
                <RangeEnumeration></RangeEnumeration>
                <Units></Units>
                <Description><![CDATA[]]></Description>
            </Item>
            <Item ID="2">
                <Name>LocalHmiAvailable</Name>
                <Operations>RW</Operations>
                <MultipleInstances>Single</MultipleInstances>
                <Mandatory>Mandatory</Mandatory>
                <Type>Boolean</Type>
                <RangeEnumeration></RangeEnumeration>
                <Units></Units>
                <Description><![CDATA[]]></Description>
            </Item>
            <Item ID="3">
                <Name>Model__deviceType</Name>
                <Operations>RW</Operations>
                <MultipleInstances>Single</MultipleInstances>
                <Mandatory>Mandatory</Mandatory>
                <Type>Unsigned Integer</Type>
                <RangeEnumeration></RangeEnumeration>
                <Units></Units>
                <Description><![CDATA[]]></Description>
            </Item>
            <Item ID="4">
                <Name>Model__deviceVariant</Name>
                <Operations>RW</Operations>
                <MultipleInstances>Single</MultipleInstances>
                <Mandatory>Mandatory</Mandatory>
                <Type>Unsigned Integer</Type>
                <RangeEnumeration></RangeEnumeration>
                <Units></Units>
                <Description><![CDATA[]]></Description>
            </Item>
            <Item ID="5">
                <Name>SerialNumber</Name>
                <Operations>RW</Operations>
                <MultipleInstances>Single</MultipleInstances>
                <Mandatory>Mandatory</Mandatory>
                <Type>Unsigned Integer</Type>
                <RangeEnumeration></RangeEnumeration>
                <Units></Units>
                <Description><![CDATA[]]></Description>
            </Item>
            <Item ID="6">
                <Name>ConfigVersionString</Name>
                <Operations>R</Operations>
                <MultipleInstances>Single</MultipleInstances>
                <Mandatory>Mandatory</Mandatory>
                <Type>String</Type>
                <RangeEnumeration></RangeEnumeration>
                <Units></Units>
                <Description><![CDATA[]]></Description>
            </Item>
            <Item ID="7">
                <Name>SwUpdateRequired</Name>
                <Operations>R</Operations>
                <MultipleInstances>Single</MultipleInstances>
                <Mandatory>Mandatory</Mandatory>
                <Type>Boolean</Type>
                <RangeEnumeration></RangeEnumeration>
                <Units></Units>
                <Description><![CDATA[]]></Description>
            </Item>
            <Item ID="8">
                <Name>ForcedSwUpdateRequired</Name>
                <Operations>RW</Operations>
                <MultipleInstances>Single</MultipleInstances>
                <Mandatory>Mandatory</Mandatory>
                <Type>Boolean</Type>
                <RangeEnumeration></RangeEnumeration>
                <Units></Units>
                <Description><![CDATA[]]></Description>
            </Item>
            <Item ID="9">
                <Name>SwPackageVersionString</Name>
                <Operations>R</Operations>
                <MultipleInstances>Single</MultipleInstances>
                <Mandatory>Mandatory</Mandatory>
                <Type>String</Type>
                <RangeEnumeration></RangeEnumeration>
                <Units></Units>
                <Description><![CDATA[]]></Description>
            </Item>
            <Item ID="10">
                <Name>DeviceGroup</Name>
                <Operations>R</Operations>
                <MultipleInstances>Single</MultipleInstances>
                <Mandatory>Mandatory</Mandatory>
                <Type>Unsigned Integer</Type>
                <RangeEnumeration></RangeEnumeration>
                <Units></Units>
                <Description><![CDATA[]]></Description>
            </Item>
            <Item ID="11">
                <Name>ClearStartupSequenceRequired</Name>
                <Operations>E</Operations>
                <MultipleInstances>Single</MultipleInstances>
                <Mandatory>Mandatory</Mandatory>
                <Type></Type>
                <RangeEnumeration></RangeEnumeration>
                <Units></Units>
                <Description><![CDATA[]]></Description>
            </Item>
            <Item ID="12">
                <Name>ResetToUserDefault</Name>
                <Operations>E</Operations>
                <MultipleInstances>Single</MultipleInstances>
                <Mandatory>Mandatory</Mandatory>
                <Type></Type>
                <RangeEnumeration></RangeEnumeration>
                <Units></Units>
                <Description><![CDATA[]]></Description>
            </Item>
            <Item ID="13">
                <Name>ApplyConfigDone__Event</Name>
                <Operations>R</Operations>
                <MultipleInstances>Single</MultipleInstances>
                <Mandatory>Optional</Mandatory>
                <Type>Boolean</Type>
                <RangeEnumeration></RangeEnumeration>
                <Units></Units>
                <Description><![CDATA[Representation of apply config done event (no event data)]]></Description>
            </Item>
            <Item ID="14">
                <Name>ApplyConfigError__Event</Name>
                <Operations>R</Operations>
                <MultipleInstances>Single</MultipleInstances>
                <Mandatory>Optional</Mandatory>
                <Type>Boolean</Type>
                <RangeEnumeration></RangeEnumeration>
                <Units></Units>
                <Description><![CDATA[Representation of apply config error event (no event data)]]></Description>
            </Item>
        </Resources>
        <Description2><![CDATA[]]></Description2>
    </Object>
</LWM2M>
