<?xml version="1.0" encoding="utf-8"?>
<!--
SPDX-FileCopyrightText: Copyright (c) 2022 GARDENA GmbH
SPDX-License-Identifier: LicenseRef-GARDENA
-->
<LWM2M xmlns:xsi="http://www.w3.org/2001/XMLSchema-instance" xsi:noNamespaceSchemaLocation="http://www.openmobilealliance.org/tech/profiles/LWM2M-v1_1.xsd">
    <Object ObjectType="MODefinition">
		<Name>Actuator</Name>
		<Description1><![CDATA[Generic actuator control for valves, power switch, mower, etc.]]></Description1>
		<ObjectID>28180</ObjectID>
		<ObjectURN>urn:oma:lwm2m:x:28180:0.3</ObjectURN>
		<LWM2MVersion>1.1</LWM2MVersion>
		<ObjectVersion>0.3</ObjectVersion>
		<MultipleInstances>Multiple</MultipleInstances>
		<Mandatory>Optional</Mandatory>
		<Resources>
			<Item ID="1">
				<Name>default_duration_seconds</Name>
				<Operations>RW</Operations>
				<MultipleInstances>Single</MultipleInstances>
				<Mandatory>Mandatory</Mandatory>
				<Type>Integer</Type>
				<RangeEnumeration></RangeEnumeration>
				<Units>s</Units>
				<Description><![CDATA[Duration of action started with a physical button. Setting to 0 disables the start on button press.]]></Description>
			</Item>
			<Item ID="2">
				<Name>available</Name>
				<Operations>R</Operations>
				<MultipleInstances>Single</MultipleInstances>
				<Mandatory>Mandatory</Mandatory>
				<Type>Boolean</Type>
				<RangeEnumeration></RangeEnumeration>
				<Units></Units>
				<Description><![CDATA[Indicate whether this actuator is available (e.g. valve connected)]]></Description>
			</Item>
			<Item ID="3">
				<Name>error</Name>
				<Operations>R</Operations>
				<MultipleInstances>Single</MultipleInstances>
				<Mandatory>Mandatory</Mandatory>
				<Type>Integer</Type>
				<RangeEnumeration></RangeEnumeration>
				<Units></Units>
				<Description><![CDATA[Device and/or actuator specific error]]></Description>
			</Item>
			<Item ID="4">
				<Name>paused_until</Name>
				<Operations>RW</Operations>
				<MultipleInstances>Single</MultipleInstances>
				<Mandatory>Mandatory</Mandatory>
				<Type>Time</Type>
				<RangeEnumeration></RangeEnumeration>
				<Units>s</Units>
				<Description><![CDATA[Scheduled actions paused until seconds from unix epoch]]></Description>
			</Item>
			<Item ID="5">
				<Name>name</Name>
				<Operations>RW</Operations>
				<MultipleInstances>Single</MultipleInstances>
				<Mandatory>Mandatory</Mandatory>
				<Type>String</Type>
				<RangeEnumeration></RangeEnumeration>
				<Units></Units>
				<Description><![CDATA[Name to be used for homekit?]]></Description>
			</Item>
			<Item ID="6">
				<Name>master</Name>
				<Operations>RW</Operations>
				<MultipleInstances>Single</MultipleInstances>
				<Mandatory>Optional</Mandatory>
				<Type>Objlnk</Type>
				<RangeEnumeration></RangeEnumeration>
				<Units></Units>
				<Description><![CDATA[Link to master valve object, or (65535,65535) if directly controlled.]]></Description>
			</Item>
			<Item ID="7">
				<Name>current</Name>
				<Operations>R</Operations>
				<MultipleInstances>Single</MultipleInstances>
				<Mandatory>Optional</Mandatory>
				<Type>Integer</Type>
				<RangeEnumeration></RangeEnumeration>
				<Units>mA</Units>
				<Description><![CDATA[Current in mA (optional)]]></Description>
			</Item>
			<Item ID="32">
				<Name>start</Name>
				<Operations>E</Operations>
				<MultipleInstances>Single</MultipleInstances>
				<Mandatory>Mandatory</Mandatory>
				<Type></Type>
				<RangeEnumeration></RangeEnumeration>
				<Units></Units>
				<Description><![CDATA[Start with source (backend, app, homekit, ...) and seconds param. See Timeslot/start_source for more info about sources.
]]></Description>
			</Item>
			<Item ID="33">
				<Name>stop</Name>
				<Operations>E</Operations>
				<MultipleInstances>Single</MultipleInstances>
				<Mandatory>Mandatory</Mandatory>
				<Type></Type>
				<RangeEnumeration></RangeEnumeration>
				<Units></Units>
				<Description><![CDATA[Stop with source (backend or app)]]></Description>
			</Item>
		</Resources>
		<Description2><![CDATA[]]></Description2>
	</Object>
</LWM2M>
