<?xml version="1.0" encoding="utf-8"?>
<!--
SPDX-FileCopyrightText: Copyright (c) 2022 GARDENA GmbH
SPDX-License-Identifier: LicenseRef-GARDENA
-->
<LWM2M xmlns:xsi="http://www.w3.org/2001/XMLSchema-instance" xsi:noNamespaceSchemaLocation="http://www.openmobilealliance.org/tech/profiles/LWM2M-v1_1.xsd">
    <Object ObjectType="MODefinition">
		<Name>Position__RecentPositions</Name>
		<Description1><![CDATA[]]></Description1>
		<ObjectID>31505</ObjectID>
		<ObjectURN>urn:oma:lwm2m:x:31505:0.1</ObjectURN>
		<LWM2MVersion>1.1</LWM2MVersion>
		<ObjectVersion>0.1</ObjectVersion>
		<MultipleInstances>Multiple</MultipleInstances>
		<Mandatory>Optional</Mandatory>
		<Resources>
			<Item ID="1">
				<Name>longitude</Name>
				<Operations>R</Operations>
				<MultipleInstances>Single</MultipleInstances>
				<Mandatory>Mandatory</Mandatory>
				<Type>Integer</Type>
				<RangeEnumeration></RangeEnumeration>
				<Units>0.1 micro degree</Units>
				<Description><![CDATA[]]></Description>
			</Item>
			<Item ID="2">
				<Name>latitude</Name>
				<Operations>R</Operations>
				<MultipleInstances>Single</MultipleInstances>
				<Mandatory>Mandatory</Mandatory>
				<Type>Integer</Type>
				<RangeEnumeration></RangeEnumeration>
				<Units>0.1 micro degree</Units>
				<Description><![CDATA[]]></Description>
			</Item>
		</Resources>
		<Description2><![CDATA[]]></Description2>
	</Object>
</LWM2M>
